title,price,reviews,rating,company,customerreviews,link
"Spacewood Rio Queen Size Engineered Wood Bed with Box Storage (Woodpore Finish, Natural Teak)",16499.0,93,3.3,Spacewood,3.3 out of 5 stars,https://www.amazon.in/Spacewood-Storage-Woodpore-Finish-Natural/dp/B076122D8S/ref=sr_1_13?keywords=bed&qid=1559923881&s=gateway&sr=8-13
HomeTown Bolton King Size Engineered Wood Bed With Box Storage (Particle Board - Wenge),,13,3.6,HomeTown,3.6 out of 5 stars,https://www.amazon.in/HomeTown-Bolton-King-Engineered-Storage/dp/B0721JRDXY/ref=sr_1_38?keywords=bed&qid=1559923881&s=gateway&sr=8-38
M&M Single Size Solid Wood Trundle Bed (Sheesham Wood - Brown),7989.0,1,5.0,M&M,5.0 out of 5 stars,https://www.amazon.in/Sheesham-Single-Trundle-Walnut-Finish/dp/B07K33Y7Q7/ref=sr_1_33?keywords=bed&qid=1559923881&s=gateway&sr=8-33
Kurtzy Folding Bed Cot for Camping Picnic Home and Outdoor,2899.0,12,3.7,Kurtzy,3.7 out of 5 stars,https://www.amazon.in/Kurtzy-Folding-Camping-Picnic-Outdoor/dp/B07NDXFKBC/ref=sr_1_28?keywords=bed&qid=1559923881&s=gateway&sr=8-28
NA ENTERPRISESS Single Size Foldable Bed (Black),,13,3.8,NA ENTERPRISES,3.8 out of 5 stars,https://www.amazon.in/NA-ENTERPRISESS-Single-Foldable-Black/dp/B07LH3SKWW/ref=sr_1_11?keywords=bed&qid=1559923881&s=gateway&sr=8-11
@home by Nilkamal Nation Queen Size Solid Wood Bed (Rubber Wood - Walnut),10890.0,20,3.0,@home By Nilkamal,3.0 out of 5 stars,https://www.amazon.in/home-Nilkamal-Nation-Without-Storage/dp/B06WGL8GDL/ref=sr_1_16?keywords=bed&qid=1559923881&s=gateway&sr=8-16
"AmazonBasics Plat Form, Bed Frame, Black, Single",3499.0,5,4.3,AmazonBasics,4.3 out of 5 stars,https://www.amazon.in/AmazonBasics-Platform-Frame-Black-Twin/dp/B073WR319C/ref=sr_1_9?keywords=bed&qid=1559923881&s=gateway&smid=AT95IG9ONZD7S&sr=8-9
Spacewood Joy Queen Size Engineered Wood Bed (Particle Board - Natural Wenge),11999.0,111,3.1,Spacewood,3.1 out of 5 stars,https://www.amazon.in/Spacewood-Queen-Woodpore-Finish-Natural/dp/B075JLZ1GF/ref=sr_1_17?keywords=bed&qid=1559923881&s=gateway&sr=8-17
Urban Ladder Osaka Queen Size Solid Wood Bed (Rubber Wood - Dark Walnut),16999.0,20,3.8,Urban Ladder,3.8 out of 5 stars,https://www.amazon.in/dp/B01LZ1XIL7?aaxitk=u0fvd51KRkgCMxdedxkXAw&pd_rd_i=B01LZ1XIL7&pf_rd_p=ddc78b0d-0a78-403f-9399-68105b975bab&hsa_cr_id=5368953230202&sb-ci-n=asinImage&sb-ci-v=https%3A%2F%2Fimages-na.ssl-images-amazon.com%2Fimages%2FI%2F31amcf3wnoL.jpg&sb-ci-a=B01LZ1XIL7
"PARVESH Smart Plywood Folding Bed Size 36"" X 72"" with Castor Wheel",2690.0,8,3.5,PARVESH,3.5 out of 5 stars,https://www.amazon.in/PARVESH-Smart-Plywood-Folding-Castor/dp/B07PQMMSRL/ref=sr_1_27?keywords=bed&qid=1559923881&s=gateway&sr=8-27
Klassic Single Size Folding Bed | Iron Folding Bed | Wood Folding Bed for Household Purpose (Large),2999.0,71,3.8,Klassic,3.8 out of 5 stars,https://www.amazon.in/Klassic-Single-Folding-Household-Purpose/dp/B07GJHJQ26/ref=sr_1_7?keywords=bed&qid=1559923881&s=gateway&sr=8-7
DeckUp Noordin Queen Size Engineered Wood Bed With Box Storage (Plywood - Dark Wenge),,11,4.2,DeckUp,4.2 out of 5 stars,https://www.amazon.in/DeckUp-Engineered-Finish-Noordin-Storage/dp/B07CYS7J4J/ref=sr_1_19?keywords=bed&qid=1559923881&s=gateway&sr=8-19
"Camabeds Easy Single Premium Roll Away Bed with Castor Wheels and 5"" Mattress",11999.0,129,3.5,Camabeds,3.5 out of 5 stars,https://www.amazon.in/Camabeds-Single-Premium-Castor-Mattress/dp/B01M8L9AML/ref=sr_1_15?keywords=bed&qid=1559923881&s=gateway&sr=8-15
Sahni Portable furniture Single Folding Steel Bed with Mattress Red Color (188 cm x 91cm),6299.0,4,4.7,Sahni Portable Furniture,4.7 out of 5 stars,https://www.amazon.in/Sahni-Portable-furniture-Folding-Mattress/dp/B07PZJZVN5/ref=sr_1_50?keywords=bed&qid=1559923881&s=gateway&sr=8-50
"Spacewood Rio Queen Size Engineered Wood Bed with Box Storage (Woodpore Finish, Natural Teak)",16499.0,93,3.3,Spacewood,3.3 out of 5 stars,https://www.amazon.in/Spacewood-Storage-Woodpore-Finish-Natural/dp/B076122D8S/ref=sr_1_13?keywords=bed&qid=1559923881&s=gateway&sr=8-13
Urban Ladder Yorktown Single Size Solid Wood Bed (Rosewood - Brown),,5,3.8,Urban Ladder,3.8 out of 5 stars,https://www.amazon.in/dp/B01N3TVO4W?aaxitk=u0fvd51KRkgCMxdedxkXAw&pd_rd_i=B01N3TVO4W&pf_rd_p=ddc78b0d-0a78-403f-9399-68105b975bab&hsa_cr_id=5368953230202&sb-ci-n=productDescription&sb-ci-v=Urban%20Ladder%20Yorktown%20Single%20Size%20Solid%20Wood%20Bed%20(Rosewood%20-%20Brown)
Ebco Aurora Gas Pump up To 120 Kgs Pro-Lift Fitting Easy Fit for A King Size Double Bed with Extended ARM (5'),3599.0,2,3.0,Ebco,3.0 out of 5 stars,https://www.amazon.in/Ebco-Aurora-Pro-Lift-Fitting-Extended/dp/B07Q4CVSX2/ref=sr_1_8?keywords=bed&qid=1559923881&s=gateway&sr=8-8
Folding BEDS PLY | Foldable BEDS Plywood,,1,3.0,STMMZ,3.0 out of 5 stars,https://www.amazon.in/Folding-BEDS-PLY-Foldable-Plywood/dp/B07RSKCLXB/ref=sr_1_32?keywords=bed&qid=1559923881&s=gateway&sr=8-32
Camabeds Smart Single Folding Guest Bed with Sprung Mattress Base,3599.0,66,2.9,Camabeds,2.9 out of 5 stars,https://www.amazon.in/Camabeds-Single-Folding-Sprung-Mattress/dp/B01M7SOS3P/ref=sr_1_35?keywords=bed&qid=1559923881&s=gateway&sr=8-35
NA ENTERPRISESS Single Size Foldable Bed (Black),,13,3.8,NA ENTERPRISES,3.8 out of 5 stars,https://www.amazon.in/NA-ENTERPRISESS-Single-Foldable-Black/dp/B07LH3SKWW/ref=sr_1_11?keywords=bed&qid=1559923881&s=gateway&sr=8-11
Spacewood Uno Queen Size Engineered Wood Bed (Particle Board - Natural Teak),11999.0,52,3.0,Spacewood,3.0 out of 5 stars,https://www.amazon.in/Spacewood-Queen-Woodpore-Finish-Natural/dp/B075ZZ4SS6/ref=sr_1_44?keywords=bed&qid=1559923881&s=gateway&sr=8-44
Amazon Brand - Solimo Antares Engineered Wood Single Bed (Caramel Mahogany Finish),8999.0,nan,nan,Amazon Brand - Solimo,,https://www.amazon.in/Amazon-Brand-Antares-Engineered-Mahogany/dp/B07LC8L9V5/ref=sr_1_14?keywords=bed&qid=1559923881&s=gateway&sr=8-14
Forzza Jasper King Size Engineered Wood Bed with Headboard Storage (Particle Board - Wenge),,46,3.5,Forzza,3.5 out of 5 stars,https://www.amazon.in/Forzza-Jasper-King-Size-Wenge/dp/B079VNVDVC/ref=sr_1_30?keywords=bed&qid=1559923881&s=gateway&sr=8-30
South Whales Single Folding Platform Bed | Portable Bed for Sleeping | Beds for Guest | Camp Bed | Tool-Free Assembled | Under-Bed Storage - Random Color,,4,4.6,South Whales,4.6 out of 5 stars,https://www.amazon.in/South-Whales-Tool-Free-Assembled-Under-Bed/dp/B07RM4PX4G/ref=sr_1_23?keywords=bed&qid=1559923881&s=gateway&sr=8-23
Ebco Aurora Wall Bed Fittings -Horizontal (Capacity-75 kg),3200.0,nan,nan,Ebco,,https://www.amazon.in/Ebco-Aurora-Fittings-Horizontal-Capacity-75/dp/B07J1S71N4/ref=sr_1_41?keywords=bed&qid=1559923881&s=gateway&sr=8-41
Spacewood Riva Queen Size Engineered Wood Bed (Particle Board - Natural Wenge),11999.0,121,3.7,Spacewood,3.7 out of 5 stars,https://www.amazon.in/Spacewood-Queen-Woodpore-Finish-Natural/dp/B076D7QK9B/ref=sr_1_10?keywords=bed&qid=1559923881&s=gateway&sr=8-10
FurnitureKraft Milan Single Size Metal Bunk Bed (Mild Steel - Black),8999.0,11,3.8,FurnitureKraft,3.8 out of 5 stars,https://www.amazon.in/FurnitureKraft-Milan-Metal-Bunk-Black/dp/B072FH4TTR/ref=sr_1_18?keywords=bed&qid=1559923881&s=gateway&sr=8-18
"PARVESH Steel Plywood Folding Bed Size 36"" X 72""",2490.0,1,5.0,parkash steel,5.0 out of 5 stars,https://www.amazon.in/PARVESH-Steel-Plywood-Folding-Size/dp/B07Q31N2ZY/ref=sr_1_22?keywords=bed&qid=1559923881&s=gateway&sr=8-22
"Camabeds Easy Single Premium Roll Away Bed with Castor Wheels and 5"" Mattress",11999.0,129,3.5,Camabeds,3.5 out of 5 stars,https://www.amazon.in/Camabeds-Single-Premium-Castor-Mattress/dp/B01M8L9AML/ref=sr_1_15?keywords=bed&qid=1559923881&s=gateway&sr=8-15
Spacewood Joy Queen Size Engineered Wood Bed (Particle Board - Natural Wenge),11999.0,111,3.1,Spacewood,3.1 out of 5 stars,https://www.amazon.in/Spacewood-Queen-Woodpore-Finish-Natural/dp/B075JLZ1GF/ref=sr_1_17?keywords=bed&qid=1559923881&s=gateway&sr=8-17
HomeTown Tweady Queen Size Engineered Wood Bed (MDF - Denever Oak),,1,5.0,HomeTown,5.0 out of 5 stars,https://www.amazon.in/HomeTown-Tweady-Engineered-Denever-Colour/dp/B07J37L2GN/ref=sr_1_47?keywords=bed&qid=1559923881&s=gateway&sr=8-47
Forzza Jasper King Size Engineered Wood Bed with Headboard Storage (Particle Board - Wenge),,46,3.5,Forzza,3.5 out of 5 stars,https://www.amazon.in/Forzza-Jasper-King-Size-Wenge/dp/B079VNVDVC/ref=sr_1_30?keywords=bed&qid=1559923881&s=gateway&sr=8-30
Amazon Brand - Solimo Vega Engineered Wood Hydraulic Half Lift-on Queen Bed (Espresso Finish),19999.0,1,4.0,Amazon Brand - Solimo,4.0 out of 5 stars,https://www.amazon.in/Amazon-Brand-Engineered-Hydraulic-Lift/dp/B07LC5Y95W/ref=sr_1_40?keywords=bed&qid=1559923881&s=gateway&sr=8-40
iBED Hideaway Guest Bed,,nan,nan,ibed,,https://www.amazon.in/ibed-FPB956-iBED-Hideaway-Guest/dp/B00839K1IG/ref=sr_1_49?keywords=bed&qid=1559923881&s=gateway&sr=8-49
FurnitureKraft Milan Single Size Metal Bunk Bed (Mild Steel - Black),8999.0,11,3.8,FurnitureKraft,3.8 out of 5 stars,https://www.amazon.in/FurnitureKraft-Milan-Metal-Bunk-Black/dp/B072FH4TTR/ref=sr_1_18?keywords=bed&qid=1559923881&s=gateway&sr=8-18
"FurnitureKraft Osaka Single Size Metal Bed (Glossy Finish, Black)",4099.0,56,3.1,FurnitureKraft,3.1 out of 5 stars,https://www.amazon.in/FurnitureKraft-Osaka-Metal-Single-Black/dp/B01N2YX0I2/ref=sr_1_6?keywords=bed&qid=1559923881&s=gateway&sr=8-6
"Fine living Queen Size Metal Bed With Hydraulic Storage (Glossy Finish, Jet Black)",18300.0,5,4.4,Fine Living,4.4 out of 5 stars,https://www.amazon.in/Fine-living-Queen-Lifton-Storage/dp/B078NWM6WJ/ref=sr_1_42?keywords=bed&qid=1559923881&s=gateway&sr=8-42
Spacewood Single Size Engineered Wood Bed with Box Storage (Particle Board - Walnut Rigato),9299.0,29,3.0,Spacewood,3.0 out of 5 stars,https://www.amazon.in/Spacewood-Single-Size-Walnut-Rigato/dp/B015INI2LW/ref=sr_1_48?keywords=bed&qid=1559923881&s=gateway&sr=8-48
"FurnitureKraft Osaka Single Size Metal Bed (Glossy Finish, Black)",4099.0,56,3.1,FurnitureKraft,3.1 out of 5 stars,https://www.amazon.in/FurnitureKraft-Osaka-Metal-Single-Black/dp/B01N2YX0I2/ref=sr_1_6?keywords=bed&qid=1559923881&s=gateway&sr=8-6
DELITE KOM Cocoa Single Size Engineered Wood Bed (Particle Board - Acacia Dark),7999.0,nan,nan,DELITE KOM,,https://www.amazon.in/Delite-Cocoa-Single-Finish-Acacia/dp/B07G3MDYTT/ref=sr_1_34?keywords=bed&qid=1559923881&s=gateway&sr=8-34
DeckUp Dusun Queen Size Engineered Wood Bed (Particle Board - Dark Wenge),,22,3.4,DeckUp,3.4 out of 5 stars,https://www.amazon.in/DeckUp-Dusun-Queen-Wenge-Finish/dp/B07CZ26PRP/ref=sr_1_26?keywords=bed&qid=1559923881&s=gateway&sr=8-26
@home by Nilkamal Borden King Size Engineered Wood Bed with Headboard Storage (Pre-Laminated Engineered Wood - Black),,1,5.0,@home By Nilkamal,5.0 out of 5 stars,https://www.amazon.in/home-Nilkamal-Borden-Headboard-Storage/dp/B07K4Y29PM/ref=sr_1_45?keywords=bed&qid=1559923881&s=gateway&sr=8-45
"PARVESH Smart Niwar Folding Bed Size 36"" X 72""",1799.0,19,3.2,PARVESH,3.2 out of 5 stars,https://www.amazon.in/PARVESH-Smart-Niwar-Folding-Size/dp/B07PRLM15N/ref=sr_1_20?keywords=bed&qid=1559923881&s=gateway&sr=8-20
parkash steel Smart Folding Plastic Bed with 5 inch Mattress and Casters Wheels,5999.0,17,3.7,parkash steel,3.7 out of 5 stars,https://www.amazon.in/parkash-steel-Folding-Plastic-Mattress/dp/B07H265TWF/ref=sr_1_46?keywords=bed&qid=1559923881&s=gateway&sr=8-46
Klassic Single Size Folding Bed | Iron Folding Bed | Niwar Folding Bed for Household Purpose (Large),2199.0,33,3.6,Klassic,3.6 out of 5 stars,https://www.amazon.in/Klassic-Single-Folding-Household-Purpose/dp/B07GJQNB4B/ref=sr_1_24?keywords=bed&qid=1559923881&s=gateway&sr=8-24
"Ebco Aurora Maximum 75 kgs Gas Pump Pro-Lift Fitting Easy Fit for A Queen Size Double Bed (3-4 feet, Regular ARM)",2739.0,nan,nan,Ebco,,https://www.amazon.in/Ebco-Maximum-Pro-Lift-Fitting-Regular/dp/B07Q5FRYZR/ref=sr_1_5?keywords=bed&qid=1559923881&s=gateway&sr=8-5
"Fine living Queen Size Metal Bed With Hydraulic Storage (Glossy Finish, Jet Black)",18300.0,5,4.4,Fine Living,4.4 out of 5 stars,https://www.amazon.in/Fine-living-Queen-Lifton-Storage/dp/B078NWM6WJ/ref=sr_1_42?keywords=bed&qid=1559923881&s=gateway&sr=8-42
Urban Ladder Osaka Queen Size Solid Wood Bed (Rubber Wood - Dark Walnut),16999.0,20,3.8,Urban Ladder,3.8 out of 5 stars,https://www.amazon.in/dp/B01LZ1XIL7?aaxitk=u0fvd51KRkgCMxdedxkXAw&pd_rd_i=B01LZ1XIL7&pf_rd_p=ddc78b0d-0a78-403f-9399-68105b975bab&hsa_cr_id=5368953230202&sb-ci-n=starRating&sb-ci-v=4.0&sb-ci-m=20&sb-ci-a=B01LZ1XIL7
South Whales Single Folding Platform Bed | Portable Bed for Sleeping | Beds for Guest | Camp Bed | Tool-Free Assembled | Under-Bed Storage - Random Color,,4,4.6,South Whales,4.6 out of 5 stars,https://www.amazon.in/South-Whales-Tool-Free-Assembled-Under-Bed/dp/B07RM4PX4G/ref=sr_1_23?keywords=bed&qid=1559923881&s=gateway&sr=8-23
Ebco Aurora Gas Pump up To 120 Kgs Pro-Lift Fitting Easy Fit for A King Size Double Bed with Extended ARM (5'),3599.0,2,3.0,Ebco,3.0 out of 5 stars,https://www.amazon.in/Ebco-Aurora-Pro-Lift-Fitting-Extended/dp/B07Q4CVSX2/ref=sr_1_8?keywords=bed&qid=1559923881&s=gateway&sr=8-8
Urban Ladder Sutherland Queen Size Engineered Wood Bed with Pull Out Storage (Particle Board - Dark Oak),,6,3.9,Urban Ladder,3.9 out of 5 stars,https://www.amazon.in/dp/B01LW6M93Q?aaxitk=u0fvd51KRkgCMxdedxkXAw&pd_rd_i=B01LW6M93Q&pf_rd_p=ddc78b0d-0a78-403f-9399-68105b975bab&hsa_cr_id=5368953230202&sb-ci-n=starRating&sb-ci-v=4.0&sb-ci-m=6&sb-ci-a=B01LW6M93Q
Kurtzy Folding Bed Cot for Camping Picnic Home and Outdoor,2899.0,12,3.7,Kurtzy,3.7 out of 5 stars,https://www.amazon.in/Kurtzy-Folding-Camping-Picnic-Outdoor/dp/B07NDXFKBC/ref=sr_1_28?keywords=bed&qid=1559923881&s=gateway&sr=8-28
UNiCOS Upton Queen Size Bed (Black),8199.0,nan,nan,UNiCOS,,https://www.amazon.in/UNiCOS-Upton-Queen-Size-Black/dp/B07BN2D4H4/ref=sr_1_37?keywords=bed&qid=1559923881&s=gateway&sr=8-37
Urban Ladder Sutherland Queen Size Engineered Wood Bed with Pull Out Storage (Particle Board - Dark Oak),,6,3.9,Urban Ladder,3.9 out of 5 stars,https://www.amazon.in/dp/B01LW6M93Q?aaxitk=u0fvd51KRkgCMxdedxkXAw&pd_rd_i=B01LW6M93Q&pf_rd_p=ddc78b0d-0a78-403f-9399-68105b975bab&hsa_cr_id=5368953230202&sb-ci-n=asinImage&sb-ci-v=https%3A%2F%2Fimages-na.ssl-images-amazon.com%2Fimages%2FI%2F51g7QDwL1qL.jpg&sb-ci-a=B01LW6M93Q
Camabeds Smart Single Folding Guest Bed with Sprung Mattress Base,3599.0,66,2.9,Camabeds,2.9 out of 5 stars,https://www.amazon.in/Camabeds-Single-Folding-Sprung-Mattress/dp/B01M7SOS3P/ref=sr_1_35?keywords=bed&qid=1559923881&s=gateway&sr=8-35
"The Original Bedstead Company Mortlake King Size Metal Bed (Glossy Finish, Ivory)",9999.0,134,4.2,The Original Bedstead Company,4.2 out of 5 stars,https://www.amazon.in/Original-Bedstead-Company-Mortlake-Glossy/dp/B06XVRDKPQ/ref=sr_1_43?keywords=bed&qid=1559923881&s=gateway&sr=8-43
Regalo Double Sided Hide Away Bed Rail Tall (White),,nan,nan,Unknown,,https://www.amazon.in/Regalo-Double-Sided-Hide-White/dp/B000HK6BCE/ref=sr_1_51?keywords=bed&qid=1559923881&s=gateway&sr=8-51
Bestway Flocked Single Size Air Bed (Blue),1600.0,63,3.1,Bestway,3.1 out of 5 stars,https://www.amazon.in/Bestway-Flocked-Single-Size-Blue/dp/B00F0B5IV0/ref=sr_1_12?keywords=bed&qid=1559923881&s=gateway&sr=8-12
Urban Ladder Sutherland Queen Size Engineered Wood Bed with Pull Out Storage (Particle Board - Dark Oak),,6,3.9,Urban Ladder,3.9 out of 5 stars,https://www.amazon.in/dp/B01LW6M93Q?aaxitk=u0fvd51KRkgCMxdedxkXAw&pd_rd_i=B01LW6M93Q&pf_rd_p=ddc78b0d-0a78-403f-9399-68105b975bab&hsa_cr_id=5368953230202&sb-ci-n=productDescription&sb-ci-v=Urban%20Ladder%20Sutherland%20Queen%20Size%20Engineered%20Wood%20Bed%20with%20Pull%20Out%20Storage%20(Particle%20Board%20-%20Dark%20Oak)&sb-ci-a=B01LW6M93Q
Single Size Foldable Bed | Folding Beds (Brown) STMMZ®,,nan,nan,STMMZ,,https://www.amazon.in/Single-Foldable-Folding-Brown-STMMZ%C2%AE/dp/B07S1CDBCX/ref=sr_1_31?keywords=bed&qid=1559923881&s=gateway&sr=8-31
Spacewood Riva Queen Size Engineered Wood Bed (Particle Board - Natural Wenge),11999.0,121,3.7,Spacewood,3.7 out of 5 stars,https://www.amazon.in/Spacewood-Queen-Woodpore-Finish-Natural/dp/B076D7QK9B/ref=sr_1_10?keywords=bed&qid=1559923881&s=gateway&sr=8-10
Klassic Single Size Folding Bed | Iron Folding Bed | Wood Folding Bed for Household Purpose (Large),2999.0,71,3.8,Klassic,3.8 out of 5 stars,https://www.amazon.in/Klassic-Single-Folding-Household-Purpose/dp/B07GJHJQ26/ref=ice_ac_b_dpb?keywords=bed&qid=1559923881&s=gateway&sr=8-7
HomeTown Bolton King Size Engineered Wood Bed With Box Storage (Particle Board - Wenge),,13,3.6,HomeTown,3.6 out of 5 stars,https://www.amazon.in/HomeTown-Bolton-King-Engineered-Storage/dp/B0721JRDXY/ref=sr_1_38?keywords=bed&qid=1559923881&s=gateway&sr=8-38
Urban Ladder Osaka Queen Size Solid Wood Bed (Rubber Wood - Dark Walnut),16999.0,20,3.8,Urban Ladder,3.8 out of 5 stars,https://www.amazon.in/dp/B01LZ1XIL7?aaxitk=u0fvd51KRkgCMxdedxkXAw&pd_rd_i=B01LZ1XIL7&pf_rd_p=ddc78b0d-0a78-403f-9399-68105b975bab&hsa_cr_id=5368953230202&sb-ci-n=productDescription&sb-ci-v=Urban%20Ladder%20Osaka%20Queen%20Size%20Solid%20Wood%20Bed%20(Rubber%20Wood%20-%20Dark%20Walnut)&sb-ci-a=B01LZ1XIL7
Amazon Brand - Solimo Vega Engineered Wood Hydraulic Half Lift-on Queen Bed (Espresso Finish),19999.0,1,4.0,Amazon Brand - Solimo,4.0 out of 5 stars,https://www.amazon.in/Amazon-Brand-Engineered-Hydraulic-Lift/dp/B07LC5Y95W/ref=sr_1_40?keywords=bed&qid=1559923881&s=gateway&sr=8-40
Urban Ladder Yorktown Single Size Solid Wood Bed (Rosewood - Brown),,5,3.8,Urban Ladder,3.8 out of 5 stars,https://www.amazon.in/dp/B01N3TVO4W?aaxitk=u0fvd51KRkgCMxdedxkXAw&pd_rd_i=B01N3TVO4W&pf_rd_p=ddc78b0d-0a78-403f-9399-68105b975bab&hsa_cr_id=5368953230202&sb-ci-n=asinImage&sb-ci-v=https%3A%2F%2Fimages-na.ssl-images-amazon.com%2Fimages%2FI%2F81jrY3DxIZL.jpg&sb-ci-a=B01N3TVO4W
Royal Interiors Metal Queen Size Bed With Hydraulic Storage In Black (Matte Finish),18500.0,nan,nan,Royal Interiors,,https://www.amazon.in/Royal-Interiors-Hydraulic-Storage-Finish/dp/B077P41TQ5/ref=sr_1_21?keywords=bed&qid=1559923881&s=gateway&sr=8-21
"The Original Bedstead Company Mortlake King Size Metal Bed (Glossy Finish, Ivory)",9999.0,134,4.2,The Original Bedstead Company,4.2 out of 5 stars,https://www.amazon.in/Original-Bedstead-Company-Mortlake-Glossy/dp/B06XVRDKPQ/ref=sr_1_43?keywords=bed&qid=1559923881&s=gateway&sr=8-43
UNiCOS Zepplin Queen Size Bed (Black),6799.0,nan,nan,UNiCOS,,https://www.amazon.in/UNiCOS-Zepplin-Queen-Size-Black/dp/B07C8NSLDC/ref=sr_1_25?keywords=bed&qid=1559923881&s=gateway&sr=8-25
"AmazonBasics Plat Form, Bed Frame, Black, Single",3499.0,5,4.3,AmazonBasics,4.3 out of 5 stars,https://www.amazon.in/AmazonBasics-Platform-Frame-Black-Twin/dp/B073WR319C/ref=sr_1_9?keywords=bed&qid=1559923881&s=gateway&smid=AT95IG9ONZD7S&sr=8-9
Regalo Double Sided Hide Away Bed Rail Tall (White),,nan,nan,Unknown,,https://www.amazon.in/Regalo-Double-Sided-Hide-White/dp/B000HK6BCE/ref=sr_1_51?keywords=bed&qid=1559923881&s=gateway&sr=8-51
"GTB Portable Furniture Single Folding Bed in Iron/Metal Black Portable Single Folding Bed - Black Color Stripes, (188 cm x 91cm)",5899.0,2,5.0,GTB,5.0 out of 5 stars,https://www.amazon.in/GTB-Portable-Furniture-Single-Folding/dp/B07QWHKHV3/ref=sr_1_29?keywords=bed&qid=1559923881&s=gateway&sr=8-29
parkash steel Smart Folding Plastic Bed with 5 inch Mattress and Casters Wheels,5999.0,17,3.7,parkash steel,3.7 out of 5 stars,https://www.amazon.in/parkash-steel-Folding-Plastic-Mattress/dp/B07H265TWF/ref=sr_1_46?keywords=bed&qid=1559923881&s=gateway&sr=8-46
Spacewood Single Size Engineered Wood Bed with Box Storage (Particle Board - Walnut Rigato),9299.0,29,3.0,Spacewood,3.0 out of 5 stars,https://www.amazon.in/Spacewood-Single-Size-Walnut-Rigato/dp/B015INI2LW/ref=sr_1_48?keywords=bed&qid=1559923881&s=gateway&sr=8-48
iBED Hideaway Guest Bed,,nan,nan,ibed,,https://www.amazon.in/ibed-FPB956-iBED-Hideaway-Guest/dp/B00839K1IG/ref=sr_1_49?keywords=bed&qid=1559923881&s=gateway&sr=8-49
Urban Ladder Yorktown Single Size Solid Wood Bed (Rosewood - Brown),,5,3.8,Urban Ladder,3.8 out of 5 stars,https://www.amazon.in/dp/B01N3TVO4W?aaxitk=u0fvd51KRkgCMxdedxkXAw&pd_rd_i=B01N3TVO4W&pf_rd_p=ddc78b0d-0a78-403f-9399-68105b975bab&hsa_cr_id=5368953230202&sb-ci-n=starRating&sb-ci-v=4.0&sb-ci-m=5&sb-ci-a=B01N3TVO4W
M&M Single Size Solid Wood Trundle Bed (Sheesham Wood - Brown),7989.0,1,5.0,M&M,5.0 out of 5 stars,https://www.amazon.in/Sheesham-Single-Trundle-Walnut-Finish/dp/B07K33Y7Q7/ref=sr_1_33?keywords=bed&qid=1559923881&s=gateway&sr=8-33
"PARVESH Steel Plywood Folding Bed Size 36"" X 72""",2490.0,1,5.0,parkash steel,5.0 out of 5 stars,https://www.amazon.in/PARVESH-Steel-Plywood-Folding-Size/dp/B07Q31N2ZY/ref=sr_1_22?keywords=bed&qid=1559923881&s=gateway&sr=8-22
Folding BEDS PLY | Foldable BEDS Plywood,,1,3.0,STMMZ,3.0 out of 5 stars,https://www.amazon.in/Folding-BEDS-PLY-Foldable-Plywood/dp/B07RSKCLXB/ref=sr_1_32?keywords=bed&qid=1559923881&s=gateway&sr=8-32
DELITE KOM Pearl Queen Size Engineered Wood Bed with Box Storage (Particle Board - Wenge),16999.0,2,4.0,DELITE KOM,4.0 out of 5 stars,https://www.amazon.in/Delite-Pearl-Headboard-Storage-Finish/dp/B07G3MDM1K/ref=sr_1_39?keywords=bed&qid=1559923881&s=gateway&sr=8-39
@home by Nilkamal Borden King Size Engineered Wood Bed with Headboard Storage (Pre-Laminated Engineered Wood - Black),,1,5.0,@home By Nilkamal,5.0 out of 5 stars,https://www.amazon.in/home-Nilkamal-Borden-Headboard-Storage/dp/B07K4Y29PM/ref=sr_1_45?keywords=bed&qid=1559923881&s=gateway&sr=8-45
Bestway Flocked Single Size Air Bed (Blue),1600.0,63,3.1,Bestway,3.1 out of 5 stars,https://www.amazon.in/Bestway-Flocked-Single-Size-Blue/dp/B00F0B5IV0/ref=sr_1_12?keywords=bed&qid=1559923881&s=gateway&sr=8-12
DeckUp Dusun Queen Size Engineered Wood Bed (Particle Board - Dark Wenge),,22,3.4,DeckUp,3.4 out of 5 stars,https://www.amazon.in/DeckUp-Dusun-Queen-Wenge-Finish/dp/B07CZ26PRP/ref=sr_1_26?keywords=bed&qid=1559923881&s=gateway&sr=8-26
"PARVESH Smart Plywood Folding Bed Size 36"" X 72"" with Castor Wheel",2690.0,8,3.5,PARVESH,3.5 out of 5 stars,https://www.amazon.in/PARVESH-Smart-Plywood-Folding-Castor/dp/B07PQMMSRL/ref=sr_1_27?keywords=bed&qid=1559923881&s=gateway&sr=8-27
DELITE KOM Pearl Queen Size Engineered Wood Bed with Box Storage (Particle Board - Wenge),16999.0,2,4.0,DELITE KOM,4.0 out of 5 stars,https://www.amazon.in/Delite-Pearl-Headboard-Storage-Finish/dp/B07G3MDM1K/ref=sr_1_39?keywords=bed&qid=1559923881&s=gateway&sr=8-39
"FurnitureKraft Medan Single Size Bed (Glossy Finish, Black)",5399.0,nan,nan,FurnitureKraft,,https://www.amazon.in/FurnitureKraft-Medan-Single-Glossy-Finish/dp/B07D8D3F86/ref=sr_1_36?keywords=bed&qid=1559923881&s=gateway&sr=8-36
@home by Nilkamal Nation Queen Size Solid Wood Bed (Rubber Wood - Walnut),10890.0,20,3.0,@home By Nilkamal,3.0 out of 5 stars,https://www.amazon.in/home-Nilkamal-Nation-Without-Storage/dp/B06WGL8GDL/ref=sr_1_16?keywords=bed&qid=1559923881&s=gateway&sr=8-16
Klassic Single Size Folding Bed | Iron Folding Bed | Niwar Folding Bed for Household Purpose (Large),2199.0,33,3.6,Klassic,3.6 out of 5 stars,https://www.amazon.in/Klassic-Single-Folding-Household-Purpose/dp/B07GJQNB4B/ref=sr_1_24?keywords=bed&qid=1559923881&s=gateway&sr=8-24
HomeTown Tweady Queen Size Engineered Wood Bed (MDF - Denever Oak),,1,5.0,HomeTown,5.0 out of 5 stars,https://www.amazon.in/HomeTown-Tweady-Engineered-Denever-Colour/dp/B07J37L2GN/ref=sr_1_47?keywords=bed&qid=1559923881&s=gateway&sr=8-47
"PARVESH Smart Niwar Folding Bed Size 36"" X 72""",1799.0,19,3.2,PARVESH,3.2 out of 5 stars,https://www.amazon.in/PARVESH-Smart-Niwar-Folding-Size/dp/B07PRLM15N/ref=sr_1_20?keywords=bed&qid=1559923881&s=gateway&sr=8-20
DeckUp Noordin Queen Size Engineered Wood Bed With Box Storage (Plywood - Dark Wenge),,11,4.2,DeckUp,4.2 out of 5 stars,https://www.amazon.in/DeckUp-Engineered-Finish-Noordin-Storage/dp/B07CYS7J4J/ref=sr_1_19?keywords=bed&qid=1559923881&s=gateway&sr=8-19
"GTB Portable Furniture Single Folding Bed in Iron/Metal Black Portable Single Folding Bed - Black Color Stripes, (188 cm x 91cm)",5899.0,2,5.0,GTB,5.0 out of 5 stars,https://www.amazon.in/GTB-Portable-Furniture-Single-Folding/dp/B07QWHKHV3/ref=sr_1_29?keywords=bed&qid=1559923881&s=gateway&sr=8-29
Spacewood Uno Queen Size Engineered Wood Bed (Particle Board - Natural Teak),11999.0,52,3.0,Spacewood,3.0 out of 5 stars,https://www.amazon.in/Spacewood-Queen-Woodpore-Finish-Natural/dp/B075ZZ4SS6/ref=sr_1_44?keywords=bed&qid=1559923881&s=gateway&sr=8-44
Klassic Single Size Folding Bed | Iron Folding Bed | Wood Folding Bed for Household Purpose (Large),2999.0,71,3.8,Klassic,3.8 out of 5 stars,https://www.amazon.in/Klassic-Single-Folding-Household-Purpose/dp/B07GJHJQ26/ref=sr_1_7?keywords=bed&qid=1559923881&s=gateway&sr=8-7
Sahni Portable furniture Single Folding Steel Bed with Mattress Red Color (188 cm x 91cm),6299.0,4,4.7,Sahni Portable Furniture,4.7 out of 5 stars,https://www.amazon.in/Sahni-Portable-furniture-Folding-Mattress/dp/B07PZJZVN5/ref=sr_1_50?keywords=bed&qid=1559923881&s=gateway&sr=8-50
S.T TRADERS Folding Bed Sky Blue 3X6,,nan,nan,S.T. TRADERS,,https://www.amazon.in/S-T-TRADERS-Folding-Bed-Blue/dp/B07PGT5HFT/ref=sr_1_52?keywords=bed&qid=1559923881&s=gateway&sr=8-52
